{
  "version_id": "22222222-2222-4222-8222-222222222222",
  "skill_id": "11111111-1111-4111-8111-111111111111",
  "version": "1.2.3",
  "sha256": "0123456789abcdef0123456789abcdef0123456789abcdef0123456789abcdef",
  "published_at": "2026-08-22T08:00:00Z",
  "manifest_schema_version": 1,
  "signature_algorithm": "ed25519",
  "key_id": "registry-2026-01"
}

